{
  "type": "chart",
  "degree": "bachelors-degree",
  "semester": "BOTH",
  "isCompleted": true,
  "terms": {
    "1": [
      {
        "name": "ریاضیات پایه(پیش نیاز دانشگاهی)",
        "theoreticalUnits": 0,
        "practicalUnits": 0,
        "prerequisites": [],
        "corequisites": []
      },
      {
        "name": "زبان انگلیسی پیش دانشگاهی-ترکیبی",
        "theoreticalUnits": 0,
        "practicalUnits": 0,
        "prerequisites": [],
        "corequisites": []
      },
      {
        "name": "ریاضی عمومی 1",
        "theoreticalUnits": 3,
        "practicalUnits": 0,
        "prerequisites": [],
        "corequisites": []
      },
      {
        "name": "فیزیک 1",
        "theoreticalUnits": 3,
        "practicalUnits": 0,
        "prerequisites": [],
        "corequisites": []
      },
      {
        "name": "مبانی کامپیوتر و برنامه سازی",
        "theoreticalUnits": 3,
        "practicalUnits": 0,
        "prerequisites": [],
        "corequisites": []
      },
      {
        "name": "فارسی",
        "theoreticalUnits": 3,
        "practicalUnits": 0,
        "prerequisites": [],
        "corequisites": []
      },
      {
        "name": "انس با قرآن کریم",
        "theoreticalUnits": 1,
        "practicalUnits": 0,
        "prerequisites": [],
        "corequisites": []
      }
    ],
    "2": [
      {
        "name": "ریاضی عمومی 2",
        "theoreticalUnits": 3,
        "practicalUnits": 0,
        "prerequisites": [
          "ریاضی عمومی 1"
        ],
        "corequisites": []
      },
      {
        "name": "معادلات دیفرانسیل",
        "theoreticalUnits": 3,
        "practicalUnits": 0,
        "prerequisites": [
          "ریاضی عمومی 1"
        ],
        "corequisites": []
      },
      {
        "name": "ریاضیات گسسته",
        "theoreticalUnits": 3,
        "practicalUnits": 0,
        "prerequisites": [
          "مبانی کامپیوتر و برنامه سازی"
        ],
        "corequisites": []
      },
      {
        "name": "فیزیک 2",
        "theoreticalUnits": 3,
        "practicalUnits": 0,
        "prerequisites": [
          "فیزیک 1"
        ],
        "corequisites": []
      },
      {
        "name": "برنامه سازی پیشرفته",
        "theoreticalUnits": 3,
        "practicalUnits": 0,
        "prerequisites": [
          "مبانی کامپیوتر و برنامه سازی"
        ],
        "corequisites": []
      },
      {
        "name": "کارگاه کامپیوتر",
        "theoreticalUnits": 1,
        "practicalUnits": 0,
        "prerequisites": [
          "مبانی کامپیوتر و برنامه سازی"
        ],
        "corequisites": []
      },
      {
        "name": "زبان انگلیسی عمومی-ترکیبی(1)",
        "theoreticalUnits": 1,
        "practicalUnits": 0,
        "prerequisites": [
          "زبان انگلیسی پیش دانشگاهی-ترکیبی"
        ],
        "corequisites": []
      }
    ],
    "3": [
      {
        "name": "ریاضیات مهندسی",
        "theoreticalUnits": 3,
        "practicalUnits": 0,
        "prerequisites": [
          "ریاضی عمومی 2",
          "معادلات دیفرانسیل"
        ],
        "corequisites": []
      },
      {
        "name": "آزمایشگاه فیزیک 2",
        "theoreticalUnits": 1,
        "practicalUnits": 0,
        "prerequisites": [
          "فیزیک 2"
        ],
        "corequisites": []
      },
      {
        "name": "مدار های الکتریکی",
        "theoreticalUnits": 3,
        "practicalUnits": 0,
        "prerequisites": [
          "معادلات دیفرانسیل"
        ],
        "corequisites": []
      },
      {
        "name": "مدارهای منطقی",
        "theoreticalUnits": 3,
        "practicalUnits": 0,
        "prerequisites": [],
        "corequisites": [
          "ریاضیات گسسته"
        ]
      },
      {
        "name": "ساختمان های داده",
        "theoreticalUnits": 3,
        "practicalUnits": 0,
        "prerequisites": [
          "ریاضیات گسسته",
          "برنامه سازی پیشرفته"
        ],
        "corequisites": []
      },
      {
        "name": "تربیت بدنی",
        "theoreticalUnits": 1,
        "practicalUnits": 0,
        "prerequisites": [],
        "corequisites": []
      },
      {
        "name": "زبان انگلیسی عمومی-ترکیبی(2)",
        "theoreticalUnits": 1,
        "practicalUnits": 0,
        "prerequisites": [
          "زبان انگلیسی عمومی-ترکیبی(1)"
        ],
        "corequisites": []
      }
    ],
    "4": [
      {
        "name": "پایگاه داده ها",
        "theoreticalUnits": 3,
        "practicalUnits": 0,
        "prerequisites": [
          "ساختمان های داده"
        ],
        "corequisites": []
      },
      {
        "name": "آمار و احتمال مهندسی",
        "theoreticalUnits": 3,
        "practicalUnits": 0,
        "prerequisites": [
          "ریاضی عمومی 2"
        ],
        "corequisites": []
      },
      {
        "name": "معماری کامپیوتر",
        "theoreticalUnits": 3,
        "practicalUnits": 0,
        "prerequisites": [
          "مدارهای منطقی"
        ],
        "corequisites": []
      },
      {
        "name": "نظریه زبان ها و ماشین ها",
        "theoreticalUnits": 3,
        "practicalUnits": 0,
        "prerequisites": [
          "ساختمان های داده"
        ],
        "corequisites": []
      },
      {
        "name": "طراحی الگوریتم ها",
        "theoreticalUnits": 3,
        "practicalUnits": 0,
        "prerequisites": [
          "ساختمان های داده"
        ],
        "corequisites": []
      },
      {
        "name": "آزمایشگاه مدارهای منطقی و معماری کامپیوتر",
        "theoreticalUnits": 1,
        "practicalUnits": 0,
        "prerequisites": [
          "مدارهای منطقی"
        ],
        "corequisites": [
          "معماری کامپیوتر"
        ]
      },
      {
        "name": "زبان انگلیسی عمومی-ترکیبی(3)",
        "theoreticalUnits": 1,
        "practicalUnits": 0,
        "prerequisites": [
          "زبان انگلیسی عمومی-ترکیبی(2)"
        ],
        "corequisites": []
      }
    ],
    "5": [
      {
        "name": "سیگنال ها و سیستم ها",
        "theoreticalUnits": 3,
        "practicalUnits": 0,
        "prerequisites": [
          "ریاضیات مهندسی"
        ],
        "corequisites": []
      },
      {
        "name": "طراحی کامپیوتری سیستمهای دیجیتال",
        "theoreticalUnits": 3,
        "practicalUnits": 0,
        "prerequisites": [
          "معماری کامپیوتر"
        ],
        "corequisites": []
      },
      {
        "name": "سیستم های عامل",
        "theoreticalUnits": 3,
        "practicalUnits": 0,
        "prerequisites": [
          "معماری کامپیوتر",
          "ساختمان های داده"
        ],
        "corequisites": []
      },
      {
        "name": "طراحی شیءگرای سیستم ها",
        "theoreticalUnits": 3,
        "practicalUnits": 0,
        "prerequisites": [
          "برنامه سازی پیشرفته"
        ],
        "corequisites": []
      },
      {
        "name": "ریزپردازنده و زبان اسمبلی",
        "theoreticalUnits": 3,
        "practicalUnits": 0,
        "prerequisites": [
          "معماری کامپیوتر"
        ],
        "corequisites": []
      },
      {
        "name": "اصول طراحی کامپایلر",
        "theoreticalUnits": 3,
        "practicalUnits": 0,
        "prerequisites": [
          "ساختمان های داده"
        ],
        "corequisites": []
      }
    ],
    "6": [
      {
        "name": "هوش مصنوعی و سیستم های خبره",
        "theoreticalUnits": 3,
        "practicalUnits": 0,
        "prerequisites": [
          "ساختمان های داده"
        ],
        "corequisites": []
      },
      {
        "name": "تحلیل و طراحی سیستم ها",
        "theoreticalUnits": 3,
        "practicalUnits": 0,
        "prerequisites": [
          "برنامه سازی پیشرفته"
        ],
        "corequisites": []
      },
      {
        "name": "شبکه های کامپیوتری",
        "theoreticalUnits": 3,
        "practicalUnits": 0,
        "prerequisites": [
          "سیستم های عامل"
        ],
        "corequisites": []
      },
      {
        "name": "طراحی زبان های برنامه سازی",
        "theoreticalUnits": 3,
        "practicalUnits": 0,
        "prerequisites": [
          "اصول طراحی کامپایلر"
        ],
        "corequisites": []
      },
      {
        "name": "آزمایشگاه سیستم های عامل",
        "theoreticalUnits": 1,
        "practicalUnits": 0,
        "prerequisites": [],
        "corequisites": [
          "سیستم های عامل"
        ]
      },
      {
        "name": "آزمایشگاه ریزپردازنده",
        "theoreticalUnits": 1,
        "practicalUnits": 0,
        "prerequisites": [
          "ریزپردازنده و زبان اسمبلی"
        ],
        "corequisites": []
      },
      {
        "name": "زبان تخصصی",
        "theoreticalUnits": 2,
        "practicalUnits": 0,
        "prerequisites": [
          "زبان انگلیسی عمومی-ترکیبی(3)"
        ],
        "corequisites": []
      },
      {
        "name": "ورزش 1",
        "theoreticalUnits": 1,
        "practicalUnits": 0,
        "prerequisites": [
          "تربیت بدنی"
        ],
        "corequisites": []
      }
    ],
    "7": [
      {
        "name": "روش پژوهش و ارایه",
        "theoreticalUnits": 2,
        "practicalUnits": 0,
        "prerequisites": [
          "زبان تخصصی"
        ],
        "corequisites": []
      },
      {
        "name": "مهندسی نرم افزار",
        "theoreticalUnits": 3,
        "practicalUnits": 0,
        "prerequisites": [
          "تحلیل و طراحی سیستم ها"
        ],
        "corequisites": []
      },
      {
        "name": "مهندسی اینترنت",
        "theoreticalUnits": 3,
        "practicalUnits": 0,
        "prerequisites": [
          "شبکه های کامپیوتری"
        ],
        "corequisites": [
          "پایگاه داده ها"
        ]
      },
      {
        "name": "گرافیک کامپیوتری",
        "theoreticalUnits": 3,
        "practicalUnits": 0,
        "prerequisites": [
          "برنامه سازی پیشرفته"
        ],
        "corequisites": []
      },
      {
        "name": "آزمایشگاه شبکه های کامپیوتری",
        "theoreticalUnits": 1,
        "practicalUnits": 0,
        "prerequisites": [],
        "corequisites": [
          "شبکه های کامپیوتری"